{
  "schema_version": 2,
  "resource_kind": "realism_review",
  "resource_id": "ca4m4.arm.review.authoring-2026-08-12",
  "case_id": "ca4m4.case.arm-agency",
  "review_state": "independent_review_pending",
  "reviewed_on": "2026-08-12",
  "dimensions": {
    "procedural_law": 2,
    "deadlines_authority": 2,
    "record_consistency": 2,
    "consequences": 2,
    "oral_argument": 2,
    "bench_differentiation": 2,
    "provenance": 2
  },
  "known_uncertainty": [
    {
      "uncertainty_id": "ca4m4.arm.uncertainty.qualified-review-pending",
      "summary": "Review by a qualified immigration and appellate practitioner remains pending; no independent review is recorded and no level-3 claim is made.",
      "blocking": false
    },
    {
      "uncertainty_id": "ca4m4.arm.uncertainty.automated-legal-realism-limit",
      "summary": "Automated schema, citation, deadline, and replay checks do not establish the legal accuracy, completeness, currency, or practical realism of the cited authorities or authored analysis.",
      "blocking": false
    },
    {
      "uncertainty_id": "ca4m4.arm.uncertainty.exact-document-classification-scope",
      "summary": "Operation bindings, record tags, and semantic classifications are authored for the exact identified documents and do not generalize to novel filings, altered bytes, or unreviewed procedural circumstances.",
      "blocking": false
    },
    {
      "uncertainty_id": "ca4m4.arm.uncertainty.authored-final-order-deadline-base",
      "summary": "The January 13 final-order occurrence and each workflow deadline base are authored, bound inputs; the system validates their use but does not infer finality or select a triggering event from arbitrary records.",
      "blocking": false
    },
    {
      "uncertainty_id": "ca4m4.arm.uncertainty.counterfactual-never-filed-isolation",
      "summary": "PA128–PA177 belong only to an explicitly counterfactual, never-filed branch docket and must remain isolated from the actual appellate history and merits record.",
      "blocking": false
    },
    {
      "uncertainty_id": "ca4m4.arm.uncertainty.synthetic-bench-oral-limit",
      "summary": "The bench profiles and oral-argument behavior are synthetic training constructs; differentiation and deterministic replay do not model any real judge or predict actual advocacy, questioning, or outcomes.",
      "blocking": false
    },
    {
      "uncertainty_id": "ca4m4.arm.uncertainty.generated-pdf-provenance-limit",
      "summary": "These PDFs are generated training artifacts. Source-to-PDF checks and pinned hashes document repository provenance for the accepted render, but they do not establish external authenticity, cross-render byte determinism, or complete accessibility and typography quality.",
      "blocking": false
    }
  ]
}
